{"$schema":"https://json-schema.org/draft/2020-12/schema","$id":"planner-typography-reverse-audit.schema.json","type":"object","additionalProperties":false,"required":["audit_id","typography_profile_id","records","typography_role_mismatch_count","uncontrolled_font_override_count","uncontrolled_text_color_count","uncontrolled_font_size_override_count","aggregate_status"],"properties":{"audit_id":{"const":"PPA-TYPOGRAPHY-REVERSE-AUDIT-001"},"typography_profile_id":{"const":"PTP-001"},"records":{"type":"array","minItems":1,"items":{"$ref":"#/$defs/record"}},"typography_role_mismatch_count":{"type":"integer","minimum":0},"uncontrolled_font_override_count":{"const":0},"uncontrolled_text_color_count":{"const":0},"uncontrolled_font_size_override_count":{"const":0},"aggregate_status":{"enum":["pass","fail"]}},"$defs":{"actual":{"type":"object","additionalProperties":false,"required":["font_family","font_size_pt","bold","italic","font_color_rgb","alignment","margins_pt"],"properties":{"font_family":{"type":"string"},"font_size_pt":{"type":"number","exclusiveMinimum":0},"bold":{"type":"boolean"},"italic":{"type":"boolean"},"font_color_rgb":{"type":"string"},"alignment":{"type":"integer"},"margins_pt":{"type":"object","additionalProperties":false,"required":["left","right","top","bottom"],"properties":{"left":{"type":"number"},"right":{"type":"number"},"top":{"type":"number"},"bottom":{"type":"number"}}}}},"expected":{"type":"object","additionalProperties":false,"required":["font_family","font_size_pt","weight","italic","color_role","alignment","margins_pt"],"properties":{"font_family":{"type":"string"},"font_size_pt":{"type":"number","exclusiveMinimum":0},"weight":{"enum":["normal","bold"]},"italic":{"type":"boolean"},"color_role":{"type":"string"},"alignment":{"enum":["left","center","right"]},"margins_pt":{"type":"object","additionalProperties":false,"required":["left","right","top","bottom"],"properties":{"left":{"type":"number"},"right":{"type":"number"},"top":{"type":"number"},"bottom":{"type":"number"}}}}},"record":{"type":"object","additionalProperties":false,"required":["slide_index","shape_name","role","actual","expected_role","matches"],"properties":{"slide_index":{"type":"integer","minimum":1},"shape_name":{"type":"string"},"role":{"type":"string"},"actual":{"$ref":"#/$defs/actual"},"expected_role":{"$ref":"#/$defs/expected"},"matches":{"type":"boolean"}}}}}
