{
  "audit_id": "PPA-TYPOGRAPHY-REVERSE-AUDIT-001",
  "typography_profile_id": "PTP-001",
  "records": [
    {
      "slide_index": 1,
      "shape_name": "tds-title:PPA-CASE-A-EXPERIMENT::PPC-A118F5613DDB64C3",
      "role": "slide_title",
      "actual": {
        "font_family": "Aptos",
        "font_size_pt": 26.0,
        "bold": true,
        "italic": false,
        "font_color_rgb": "1F1F1F",
        "alignment": 1,
        "margins_pt": {
          "left": 3.0,
          "right": 3.0,
          "top": 2.0,
          "bottom": 2.0
        }
      },
      "expected_role": {
        "font_family": "Aptos",
        "font_size_pt": 26,
        "weight": "bold",
        "italic": false,
        "color_role": "foreground",
        "alignment": "left",
        "margins_pt": {
          "left": 3,
          "right": 3,
          "top": 2,
          "bottom": 2
        }
      },
      "matches": true
    },
    {
      "slide_index": 1,
      "shape_name": "PPA::PPA-CASE-A-EXPERIMENT::PPC-A118F5613DDB64C3::hardware::primary_visual::CAD",
      "role": "figure_label",
      "actual": {
        "font_family": "Aptos",
        "font_size_pt": 13.0,
        "bold": true,
        "italic": false,
        "font_color_rgb": "1F1F1F",
        "alignment": 1,
        "margins_pt": {
          "left": 3.0,
          "right": 3.0,
          "top": 2.0,
          "bottom": 2.0
        }
      },
      "expected_role": {
        "font_family": "Aptos",
        "font_size_pt": 13,
        "weight": "bold",
        "italic": false,
        "color_role": "foreground",
        "alignment": "left",
        "margins_pt": {
          "left": 3,
          "right": 3,
          "top": 2,
          "bottom": 2
        }
      },
      "matches": true
    },
    {
      "slide_index": 1,
      "shape_name": "PPA::PPA-CASE-A-EXPERIMENT::PPC-A118F5613DDB64C3::procedure::procedure::CONTROLS",
      "role": "body",
      "actual": {
        "font_family": "Aptos",
        "font_size_pt": 18.0,
        "bold": false,
        "italic": false,
        "font_color_rgb": "1F1F1F",
        "alignment": 1,
        "margins_pt": {
          "left": 3.0,
          "right": 3.0,
          "top": 2.0,
          "bottom": 2.0
        }
      },
      "expected_role": {
        "font_family": "Aptos",
        "font_size_pt": 18,
        "weight": "normal",
        "italic": false,
        "color_role": "foreground",
        "alignment": "left",
        "margins_pt": {
          "left": 3,
          "right": 3,
          "top": 2,
          "bottom": 2
        }
      },
      "matches": true
    },
    {
      "slide_index": 1,
      "shape_name": "PPA::PPA-CASE-A-EXPERIMENT::PPC-A118F5613DDB64C3::go::go_criterion::GO",
      "role": "callout",
      "actual": {
        "font_family": "Aptos",
        "font_size_pt": 15.0,
        "bold": true,
        "italic": false,
        "font_color_rgb": "B00020",
        "alignment": 1,
        "margins_pt": {
          "left": 3.0,
          "right": 3.0,
          "top": 2.0,
          "bottom": 2.0
        }
      },
      "expected_role": {
        "font_family": "Aptos",
        "font_size_pt": 15,
        "weight": "bold",
        "italic": false,
        "color_role": "focus",
        "alignment": "left",
        "margins_pt": {
          "left": 3,
          "right": 3,
          "top": 2,
          "bottom": 2
        }
      },
      "matches": true
    },
    {
      "slide_index": 2,
      "shape_name": "tds-title:PPA-CASE-B-PHYSICAL::PPC-096AA5FA0BA06EE1",
      "role": "slide_title",
      "actual": {
        "font_family": "Aptos",
        "font_size_pt": 26.0,
        "bold": true,
        "italic": false,
        "font_color_rgb": "1F1F1F",
        "alignment": 1,
        "margins_pt": {
          "left": 3.0,
          "right": 3.0,
          "top": 2.0,
          "bottom": 2.0
        }
      },
      "expected_role": {
        "font_family": "Aptos",
        "font_size_pt": 26,
        "weight": "bold",
        "italic": false,
        "color_role": "foreground",
        "alignment": "left",
        "margins_pt": {
          "left": 3,
          "right": 3,
          "top": 2,
          "bottom": 2
        }
      },
      "matches": true
    },
    {
      "slide_index": 2,
      "shape_name": "PPA::PPA-CASE-B-PHYSICAL::PPC-096AA5FA0BA06EE1::photo_a::primary_visual::PHOTO-1",
      "role": "figure_label",
      "actual": {
        "font_family": "Aptos",
        "font_size_pt": 13.0,
        "bold": true,
        "italic": false,
        "font_color_rgb": "1F1F1F",
        "alignment": 1,
        "margins_pt": {
          "left": 3.0,
          "right": 3.0,
          "top": 2.0,
          "bottom": 2.0
        }
      },
      "expected_role": {
        "font_family": "Aptos",
        "font_size_pt": 13,
        "weight": "bold",
        "italic": false,
        "color_role": "foreground",
        "alignment": "left",
        "margins_pt": {
          "left": 3,
          "right": 3,
          "top": 2,
          "bottom": 2
        }
      },
      "matches": true
    },
    {
      "slide_index": 2,
      "shape_name": "PPA::PPA-CASE-B-PHYSICAL::PPC-096AA5FA0BA06EE1::photo_b::secondary_visual::PLOT-1",
      "role": "figure_label",
      "actual": {
        "font_family": "Aptos",
        "font_size_pt": 13.0,
        "bold": true,
        "italic": false,
        "font_color_rgb": "1F1F1F",
        "alignment": 1,
        "margins_pt": {
          "left": 3.0,
          "right": 3.0,
          "top": 2.0,
          "bottom": 2.0
        }
      },
      "expected_role": {
        "font_family": "Aptos",
        "font_size_pt": 13,
        "weight": "bold",
        "italic": false,
        "color_role": "foreground",
        "alignment": "left",
        "margins_pt": {
          "left": 3,
          "right": 3,
          "top": 2,
          "bottom": 2
        }
      },
      "matches": true
    },
    {
      "slide_index": 2,
      "shape_name": "PPA::PPA-CASE-B-PHYSICAL::PPC-096AA5FA0BA06EE1::plot::validation_plot::PLOT-2",
      "role": "figure_label",
      "actual": {
        "font_family": "Aptos",
        "font_size_pt": 13.0,
        "bold": true,
        "italic": false,
        "font_color_rgb": "1F1F1F",
        "alignment": 1,
        "margins_pt": {
          "left": 3.0,
          "right": 3.0,
          "top": 2.0,
          "bottom": 2.0
        }
      },
      "expected_role": {
        "font_family": "Aptos",
        "font_size_pt": 13,
        "weight": "bold",
        "italic": false,
        "color_role": "foreground",
        "alignment": "left",
        "margins_pt": {
          "left": 3,
          "right": 3,
          "top": 2,
          "bottom": 2
        }
      },
      "matches": true
    },
    {
      "slide_index": 2,
      "shape_name": "PPA::PPA-CASE-B-PHYSICAL::PPC-096AA5FA0BA06EE1::caption_a::caption::CAPTION",
      "role": "caption",
      "actual": {
        "font_family": "Aptos",
        "font_size_pt": 12.0,
        "bold": false,
        "italic": false,
        "font_color_rgb": "666666",
        "alignment": 1,
        "margins_pt": {
          "left": 3.0,
          "right": 3.0,
          "top": 2.0,
          "bottom": 2.0
        }
      },
      "expected_role": {
        "font_family": "Aptos",
        "font_size_pt": 12,
        "weight": "normal",
        "italic": false,
        "color_role": "muted",
        "alignment": "left",
        "margins_pt": {
          "left": 3,
          "right": 3,
          "top": 2,
          "bottom": 2
        }
      },
      "matches": true
    },
    {
      "slide_index": 2,
      "shape_name": "PPA::PPA-CASE-B-PHYSICAL::PPC-096AA5FA0BA06EE1::caption_b::caption::REGION-CAPTION_B",
      "role": "caption",
      "actual": {
        "font_family": "Aptos",
        "font_size_pt": 12.0,
        "bold": false,
        "italic": false,
        "font_color_rgb": "666666",
        "alignment": 1,
        "margins_pt": {
          "left": 3.0,
          "right": 3.0,
          "top": 2.0,
          "bottom": 2.0
        }
      },
      "expected_role": {
        "font_family": "Aptos",
        "font_size_pt": 12,
        "weight": "normal",
        "italic": false,
        "color_role": "muted",
        "alignment": "left",
        "margins_pt": {
          "left": 3,
          "right": 3,
          "top": 2,
          "bottom": 2
        }
      },
      "matches": true
    },
    {
      "slide_index": 2,
      "shape_name": "PPA::PPA-CASE-B-PHYSICAL::PPC-096AA5FA0BA06EE1::measurement_c::secondary_visual::PHOTO-2",
      "role": "figure_label",
      "actual": {
        "font_family": "Aptos",
        "font_size_pt": 13.0,
        "bold": true,
        "italic": false,
        "font_color_rgb": "1F1F1F",
        "alignment": 1,
        "margins_pt": {
          "left": 3.0,
          "right": 3.0,
          "top": 2.0,
          "bottom": 2.0
        }
      },
      "expected_role": {
        "font_family": "Aptos",
        "font_size_pt": 13,
        "weight": "bold",
        "italic": false,
        "color_role": "foreground",
        "alignment": "left",
        "margins_pt": {
          "left": 3,
          "right": 3,
          "top": 2,
          "bottom": 2
        }
      },
      "matches": true
    },
    {
      "slide_index": 2,
      "shape_name": "PPA::PPA-CASE-B-PHYSICAL::PPC-096AA5FA0BA06EE1::context::compact_context::REGION-CONTEXT",
      "role": "body",
      "actual": {
        "font_family": "Aptos",
        "font_size_pt": 18.0,
        "bold": false,
        "italic": false,
        "font_color_rgb": "1F1F1F",
        "alignment": 1,
        "margins_pt": {
          "left": 3.0,
          "right": 3.0,
          "top": 2.0,
          "bottom": 2.0
        }
      },
      "expected_role": {
        "font_family": "Aptos",
        "font_size_pt": 18,
        "weight": "normal",
        "italic": false,
        "color_role": "foreground",
        "alignment": "left",